{
  "protocol_version": "1.1.0",
  "query_pack_version": "1.1.0",
  "query_pack_hash": "69ea1e988271dafaaea0ea84cc75e6eac8ad7c884ec4f66212ce57a3a68a3819",
  "scope": {
    "lanes": ["oss", "czech_products"],
    "entity_count": 20,
    "required_slot_count": 230,
    "public_sources_only": true,
    "real_or_private_data_allowed": false
  },
  "collection_method": [
    "Load and validate the exact frozen query pack and protocol before collection.",
    "Use immutable source-capture manifests and exact bounded excerpt artifacts; never treat a response status or page title as claim support.",
    "Create exactly one inspection for every frozen entity-field slot.",
    "A proven or conflicted observation must bind an exact UTF-8 excerpt byte span and matching supporting text.",
    "Use does_not_establish when inspected captured material does not support a typed observation; cited sources and locators may document the unsuccessful inspection.",
    "Treat every collector result as collector_proposed unless a synthetic fixture gate or separately bound operator decision verifies it."
  ],
  "source_priority": [
    "official API or release metadata",
    "official product, pricing, or integration documentation",
    "official repository metadata and README",
    "explicitly allowed independent evidence when the query pack permits it"
  ],
  "evidence_contract": {
    "one_or_more_field_owned_records_per_result": true,
    "public_https_only": true,
    "allowed_root_enforced": true,
    "field_specific_locator_required": true,
    "retrieval_time_inside_run_interval": true,
    "response_body_hash_required": true,
    "exact_excerpt_span_required": true,
    "operator_review_required_for_acceptance": true
  },
  "execution_contract": {
    "same_protocol_digest_for_controlled_pair": true,
    "distinct_run_id": true,
    "distinct_execution_instance_id": true,
    "collector_identity_must_be_truthful": true,
    "operator_attestation_is_separate": true,
    "paid_api_fallback_allowed": false,
    "canonical_or_prior_run_inputs_allowed": false
  },
  "authority_contract": {
    "default_classification": "collector_proposed",
    "exit_zero_classifications": ["synthetic_fixture_verified", "operator_verified"],
    "collector_can_self_attest": false
  },
  "config_digest": "93911210a90f9a8d1d3e26f46a30043041e8c5c627616cea3f34c28b554724da"
}
